ysql> create table teacherss(id int,name varchar(32),age int);
Query OK, 0 rows affected (0.11 sec)

mysql> show tables;
+----------------+
| Tables_in_105r |
+----------------+
| teacherss      |
+----------------+
1 row in set (0.02 sec)

mysql> desc teacherss;
+-------+-------------+------+-----+---------+-------+
| Field | Type        | Null | Key | Default | Extra |
+-------+-------------+------+-----+---------+-------+
| id    | int         | YES  |     | NULL    |       |
| name  | varchar(32) | YES  |     | NULL    |       |
| age   | int         | YES  |     | NULL    |       |
+-------+-------------+------+-----+---------+-------+
3 rows in set (0.01 sec)

mysql> show create table teacherss;
+-----------+------------------------------------------------------------------------------------------------------------------------------------------------------------------------------------+
| Table     | Create Table                                                                                                                                                                       |
+-----------+------------------------------------------------------------------------------------------------------------------------------------------------------------------------------------+
| teacherss | CREATE TABLE `teacherss` (
  `id` int DEFAULT NULL,
  `name` varchar(32) DEFAULT NULL,
  `age` int DEFAULT NULL
) ENGINE=InnoDB DEFAULT CHARSET=utf8mb4 COLLATE=utf8mb4_0900_ai_ci |
+-----------+------------------------------------------------------------------------------------------------------------------------------------------------------------------------------------+
1 row in set (0.01 sec)

mysql> show databases;
+--------------------+
| Database           |
+--------------------+
| 103r               |
| 104r               |
| 105r               |
| information_schema |
| mysql              |
| performance_schema |
| student            |
| sys                |
| vamsi              |
+--------------------+
9 rows in set (0.00 sec)

mysql> select * from infrom
    -> select * from infrom;
ERROR 1064 (42000): You have an error in your SQL syntax; check the manual that corresponds to your MySQL server version for the right syntax to use near 'select * from infrom' at line 2
mysql> select *
    -> from infromation_schema.columns
    -> where table_name="teacherss";
ERROR 1049 (42000): Unknown database 'infromation_schema'
mysql> select *
    -> select * from information_schema.columns
    -> where table_name="teacherss";
ERROR 1064 (42000): You have an error in your SQL syntax; check the manual that corresponds to your MySQL server version for the right syntax to use near 'select * from information_schema.columns
where table_name="teacherss"' at line 2
mysql> select *
    -> from information_schema.columns
    -> where table_name="teacherss";
+---------------+--------------+------------+-------------+------------------+----------------+-------------+-----------+--------------------------+------------------------+-------------------+---------------+--------------------+--------------------+--------------------+-------------+------------+-------+---------------------------------+----------------+-----------------------+--------+
| TABLE_CATALOG | TABLE_SCHEMA | TABLE_NAME | COLUMN_NAME | ORDINAL_POSITION | COLUMN_DEFAULT | IS_NULLABLE | DATA_TYPE | CHARACTER_MAXIMUM_LENGTH | CHARACTER_OCTET_LENGTH | NUMERIC_PRECISION | NUMERIC_SCALE | DATETIME_PRECISION | CHARACTER_SET_NAME | COLLATION_NAME     | COLUMN_TYPE | COLUMN_KEY | EXTRA | PRIVILEGES                      | COLUMN_COMMENT | GENERATION_EXPRESSION | SRS_ID |
+---------------+--------------+------------+-------------+------------------+----------------+-------------+-----------+--------------------------+------------------------+-------------------+---------------+--------------------+--------------------+--------------------+-------------+------------+-------+---------------------------------+----------------+-----------------------+--------+
| def           | 105r         | teacherss  | id          |                1 | NULL           | YES         | int       |                     NULL |                   NULL |                10 |             0 |               NULL | NULL               | NULL               | int         |            |       | select,insert,update,references |                |                       |   NULL |
| def           | 105r         | teacherss  | name        |                2 | NULL           | YES         | varchar   |                       32 |                    128 |              NULL |          NULL |               NULL | utf8mb4            | utf8mb4_0900_ai_ci | varchar(32) |            |       | select,insert,update,references |                |                       |   NULL |
| def           | 105r         | teacherss  | age         |                3 | NULL           | YES         | int       |                     NULL |                   NULL |                10 |             0 |               NULL | NULL               | NULL               | int         |            |       | select,insert,update,references |                |                       |   NULL |
+---------------+--------------+------------+-------------+------------------+----------------+-------------+-----------+--------------------------+------------------------+-------------------+---------------+--------------------+--------------------+--------------------+-------------+------------+-------+---------------------------------+----------------+-----------------------+--------+
3 rows in set (0.01 sec)

mysql> insert into table teacherss values(1,'vamsi',20),
    -> (2,'madhu',33),
    -> (3,'sai',24);
ERROR 1064 (42000): You have an error in your SQL syntax; check the manual that corresponds to your MySQL server version for the right syntax to use near 'table teacherss values(1,'vamsi',20),
(2,'madhu',33),
(3,'sai',24)' at line 1
mysql> insert into table teacherss values(1,'vamsi',20);
ERROR 1064 (42000): You have an error in your SQL syntax; check the manual that corresponds to your MySQL server version for the right syntax to use near 'table teacherss values(1,'vamsi',20)' at line 1
mysql> insert into teacherss values(1,'vamsi',20);
Query OK, 1 row affected (0.01 sec)

mysql> insert into teacherss values(2,'madhu',30),
    -> (3,'sai',34);
Query OK, 2 rows affected (0.01 sec)
Records: 2  Duplicates: 0  Warnings: 0

mysql> desc teacherss;
+-------+-------------+------+-----+---------+-------+
| Field | Type        | Null | Key | Default | Extra |
+-------+-------------+------+-----+---------+-------+
| id    | int         | YES  |     | NULL    |       |
| name  | varchar(32) | YES  |     | NULL    |       |
| age   | int         | YES  |     | NULL    |       |
+-------+-------------+------+-----+---------+-------+
3 rows in set (0.00 sec)


mysql> insert into teacherss values(2,'madhu',30);
Query OK, 1 row affected (0.01 sec)

mysql> insert into teacherss values(3,'sai',76);
Query OK, 1 row affected (0.01 sec)

mysql> show databases;
+--------------------+
| Database           |
+--------------------+
| 103r               |
| 104r               |
| 105r               |
| information_schema |
| mysql              |
| performance_schema |
| student            |
| sys                |
| vamsi              |
+--------------------+
9 rows in set (0.00 sec)

mysql> desc teacherss;
+-------+-------------+------+-----+---------+-------+
| Field | Type        | Null | Key | Default | Extra |
+-------+-------------+------+-----+---------+-------+
| id    | int         | YES  |     | NULL    |       |
| name  | varchar(32) | YES  |     | NULL    |       |
| age   | int         | YES  |     | NULL    |       |
+-------+-------------+------+-----+---------+-------+
3 rows in set (0.01 sec)

mysql> select * from teacherss;
+------+-------+------+
| id   | name  | age  |
+------+-------+------+
|    1 | vamsi |   20 |
|    2 | madhu |   30 |
|    3 | sai   |   34 |
|    2 | madhu |   30 |
|    3 | sai   |   76 |
+------+-------+------+
5 rows in set (0.00 sec)

mysql> update teacherss
    -> set name="ravi"
    -> where id=3;
Query OK, 2 rows affected (0.01 sec)
Rows matched: 2  Changed: 2  Warnings: 0

mysql> select * from teacherss;
+------+-------+------+
| id   | name  | age  |
+------+-------+------+
|    1 | vamsi |   20 |
|    2 | madhu |   30 |
|    3 | ravi  |   34 |
|    2 | madhu |   30 |
|    3 | ravi  |   76 |
+------+-------+------+
5 rows in set (0.00 sec)

mysql> delete from teacherss where id="2";
Query OK, 2 rows affected (0.01 sec)

mysql> select * from teacherss;
+------+-------+------+
| id   | name  | age  |
+------+-------+------+
|    1 | vamsi |   20 |
|    3 | ravi  |   34 |
|    3 | ravi  |   76 |
+------+-------+------+
3 rows in set (0.00 sec)


